{
  "artifact_type": "execution_contract",
  "contract_id": "exec-contract-demo-001",
  "created_at": "2026-05-06T18:21:00+00:00",
  "execution_bounds": {
    "max_commands": 1,
    "mode": "dry_run",
    "network_execution_allowed": false,
    "timeout_seconds": 0
  },
  "execution_shape": {
    "normalized_args": [
      "https://example.com/login"
    ],
    "plan": [
      {
        "args": [
          "https://example.com/login"
        ],
        "step": 1,
        "tool": "http_probe"
      }
    ],
    "tool": "http_probe"
  },
  "expected_receipt": {
    "required": true,
    "schema_ref": "schemas/execution_receipt.v0.2.schema.json"
  },
  "links": {
    "intent": {
      "descriptor": {
        "algorithm": "sha256",
        "artifact_type": "intent_contract",
        "canonical_bytes": 803,
        "canonicalization": "sclite-json-v0.1",
        "digest": "35a0f49b424851ef7a2864705bfb9e5411b049641f5734456bf45068293d492f",
        "schema_ref": "schemas/intent_contract.v0.2.schema.json",
        "schema_version": "v0.2"
      },
      "role": "intent_contract"
    },
    "policy_decision": {
      "descriptor": {
        "algorithm": "sha256",
        "artifact_type": "policy_decision",
        "canonical_bytes": 958,
        "canonicalization": "sclite-json-v0.1",
        "digest": "fe997b9400b3dbac7f562a2f946734ca189b48253b0142f137e7e13b7b669e0b",
        "schema_ref": "schemas/policy_decision.v0.2.schema.json",
        "schema_version": "v0.2"
      },
      "role": "policy_decision"
    }
  },
  "non_claims": [
    "execution_contract_is_not_runtime_execution",
    "execution_contract_requires_ticket_before_use"
  ],
  "schema_ref": "schemas/execution_contract.v0.2.schema.json",
  "schema_version": "v0.2",
  "target_binding": {
    "target": "https://example.com/login",
    "target_host": "example.com",
    "target_in_scope": true
  }
}
